17:03:00.759115 IP lior-Lenovo-YOGA-520-14IKB.32892 > 142.250.82.70.3478: UDP, length 114
17:03:00.761973 IP 142.250.82.70.3478 > lior-Lenovo-YOGA-520-14IKB.32892: UDP, length 122
17:03:00.779599 IP lior-Lenovo-YOGA-520-14IKB.32892 > 142.250.82.70.3478: UDP, length 112
17:03:00.781932 IP 142.250.82.70.3478 > lior-Lenovo-YOGA-520-14IKB.32892: UDP, length 124
17:03:00.787091 IP lior-Lenovo-YOGA-520-14IKB.32892 > 142.250.82.70.3478: UDP, length 42
17:03:00.795592 IP lior-Lenovo-YOGA-520-14IKB.39086 > 142.250.82.70.3478: UDP, length 1201
17:03:00.799441 IP lior-Lenovo-YOGA-520-14IKB.32892 > 142.250.82.70.3478: UDP, length 129
17:03:00.799728 IP lior-Lenovo-YOGA-520-14IKB.39086 > 142.250.82.70.3478: UDP, length 1201
17:03:00.802569 IP 142.250.82.70.3478 > lior-Lenovo-YOGA-520-14IKB.32892: UDP, length 111
17:03:00.804134 IP lior-Lenovo-YOGA-520-14IKB.39086 > 142.250.82.70.3478: UDP, length 1201
17:03:00.807419 IP lior-Lenovo-YOGA-520-14IKB.39086 > 142.250.82.70.3478: UDP, length 1201
17:03:00.810776 IP lior-Lenovo-YOGA-520-14IKB.39086 > 142.250.82.70.3478: UDP, length 1201
17:03:00.815104 IP lior-Lenovo-YOGA-520-14IKB.39086 > 142.250.82.70.3478: UDP, length 1201
17:03:00.817938 IP 142.250.82.70.3478 > lior-Lenovo-YOGA-520-14IKB.32892: UDP, length 58
17:03:00.819483 IP lior-Lenovo-YOGA-520-14IKB.39086 > 142.250.82.70.3478: UDP, length 1201
17:03:00.819812 IP lior-Lenovo-YOGA-520-14IKB.32892 > 142.250.82.70.3478: UDP, length 114
17:03:00.822294 IP 142.250.82.70.3478 > lior-Lenovo-YOGA-520-14IKB.32892: UDP, length 105
17:03:00.822615 IP lior-Lenovo-YOGA-520-14IKB.39086 > 142.250.82.70.3478: UDP, length 1201
17:03:00.827094 IP lior-Lenovo-YOGA-520-14IKB.39086 > 142.250.82.70.3478: UDP, length 1201
17:03:00.830385 IP lior-Lenovo-YOGA-520-14IKB.39086 > 142.250.82.70.3478: UDP, length 1201
17:03:00.833684 IP lior-Lenovo-YOGA-520-14IKB.39086 > 142.250.82.70.3478: UDP, length 1201
17:03:00.837279 IP lior-Lenovo-YOGA-520-14IKB.32892 > 142.250.82.70.3478: UDP, length 38
17:03:00.837959 IP lior-Lenovo-YOGA-520-14IKB.39086 > 142.250.82.70.3478: UDP, length 1201
17:03:00.840095 IP lior-Lenovo-YOGA-520-14IKB.32892 > 142.250.82.70.3478: UDP, length 114
17:03:00.842238 IP 142.250.82.70.3478 > lior-Lenovo-YOGA-520-14IKB.32892: UDP, length 93
17:03:00.842247 IP lior-Lenovo-YOGA-520-14IKB.39086 > 142.250.82.70.3478: UDP, length 1201
17:03:00.845553 IP lior-Lenovo-YOGA-520-14IKB.39086 > 142.250.82.70.3478: UDP, length 1201
17:03:00.849994 IP lior-Lenovo-YOGA-520-14IKB.39086 > 142.250.82.70.3478: UDP, length 1201
17:03:00.853208 IP lior-Lenovo-YOGA-520-14IKB.39086 > 142.250.82.70.3478: UDP, length 1201
17:03:00.857436 IP lior-Lenovo-YOGA-520-14IKB.39086 > 142.250.82.70.3478: UDP, length 1201
17:03:00.858873 IP lior-Lenovo-YOGA-520-14IKB.32892 > 142.250.82.70.3478: UDP, length 112
17:03:00.860730 IP lior-Lenovo-YOGA-520-14IKB.39086 > 142.250.82.70.3478: UDP, length 1201
17:03:00.862735 IP 142.250.82.70.3478 > lior-Lenovo-YOGA-520-14IKB.32892: UDP, length 96
17:03:00.864909 IP lior-Lenovo-YOGA-520-14IKB.39086 > 142.250.82.70.3478: UDP, length 1201
17:03:00.867997 IP lior-Lenovo-YOGA-520-14IKB.32892 > 142.250.82.70.3478: UDP, length 42
17:03:00.868087 IP lior-Lenovo-YOGA-520-14IKB.39086 > 142.250.82.70.3478: UDP, length 1201
17:03:00.868788 IP 142.250.82.70.3478 > lior-Lenovo-YOGA-520-14IKB.32892: UDP, length 62
17:03:00.871645 IP lior-Lenovo-YOGA-520-14IKB.32892 > 142.250.82.70.3478: UDP, length 105
17:03:00.872239 IP lior-Lenovo-YOGA-520-14IKB.39086 > 142.250.82.70.3478: UDP, length 1201
17:03:00.876608 IP lior-Lenovo-YOGA-520-14IKB.39086 > 142.250.82.70.3478: UDP, length 1201
17:03:00.879793 IP lior-Lenovo-YOGA-520-14IKB.39086 > 142.250.82.70.3478: UDP, length 1201
17:03:00.882005 IP 142.250.82.70.3478 > lior-Lenovo-YOGA-520-14IKB.32892: UDP, length 116
17:03:00.884183 IP lior-Lenovo-YOGA-520-14IKB.39086 > 142.250.82.70.3478: UDP, length 1201
17:03:00.887380 IP lior-Lenovo-YOGA-520-14IKB.32892 > 142.250.82.70.3478: UDP, length 42
17:03:00.888361 IP lior-Lenovo-YOGA-520-14IKB.39086 > 142.250.82.70.3478: UDP, length 1201
17:03:00.891592 IP lior-Lenovo-YOGA-520-14IKB.39086 > 142.250.82.70.3478: UDP, length 1201
17:03:00.891922 IP lior-Lenovo-YOGA-520-14IKB.32892 > 142.250.82.70.3478: UDP, length 105
17:03:00.893129 IP 142.250.82.70.3478 > lior-Lenovo-YOGA-520-14IKB.39086: UDP, length 66
17:03:00.893855 IP 142.250.82.70.3478 > lior-Lenovo-YOGA-520-14IKB.39086: UDP, length 130
17:03:00.894787 IP lior-Lenovo-YOGA-520-14IKB.39086 > 142.250.82.70.3478: UDP, length 1201
17:03:00.899338 IP lior-Lenovo-YOGA-520-14IKB.39086 > 142.250.82.70.3478: UDP, length 1201
17:03:00.902338 IP 142.250.82.70.3478 > lior-Lenovo-YOGA-520-14IKB.32892: UDP, length 125
17:03:00.902575 IP lior-Lenovo-YOGA-520-14IKB.39086 > 142.250.82.70.3478: UDP, length 1201
17:03:00.906833 IP lior-Lenovo-YOGA-520-14IKB.39086 > 142.250.82.70.3478: UDP, length 1201
17:03:00.909963 IP lior-Lenovo-YOGA-520-14IKB.39086 > 142.250.82.70.3478: UDP, length 1201
17:03:00.911909 IP lior-Lenovo-YOGA-520-14IKB.32892 > 142.250.82.70.3478: UDP, length 100
17:03:00.914294 IP lior-Lenovo-YOGA-520-14IKB.39086 > 142.250.82.70.3478: UDP, length 1201
17:03:00.918775 IP lior-Lenovo-YOGA-520-14IKB.39086 > 142.250.82.70.3478: UDP, length 1201
17:03:00.919983 IP 142.250.82.70.3478 > lior-Lenovo-YOGA-520-14IKB.32892: UDP, length 58
17:03:00.921948 IP lior-Lenovo-YOGA-520-14IKB.39086 > 142.250.82.70.3478: UDP, length 1201
17:03:00.922133 IP 142.250.82.70.3478 > lior-Lenovo-YOGA-520-14IKB.32892: UDP, length 111
17:03:00.926399 IP lior-Lenovo-YOGA-520-14IKB.39086 > 142.250.82.70.3478: UDP, length 1201
17:03:00.929554 IP lior-Lenovo-YOGA-520-14IKB.39086 > 142.250.82.70.3478: UDP, length 1201
17:03:00.932393 IP lior-Lenovo-YOGA-520-14IKB.32892 > 142.250.82.70.3478: UDP, length 102
17:03:00.934022 IP lior-Lenovo-YOGA-520-14IKB.39086 > 142.250.82.70.3478: UDP, length 1201
17:03:00.937209 IP lior-Lenovo-YOGA-520-14IKB.39086 > 142.250.82.70.3478: UDP, length 1201
17:03:00.937445 IP lior-Lenovo-YOGA-520-14IKB.32892 > 142.250.82.70.3478: UDP, length 38
17:03:00.941663 IP lior-Lenovo-YOGA-520-14IKB.39086 > 142.250.82.70.3478: UDP, length 1201
17:03:00.942799 IP 142.250.82.70.3478 > lior-Lenovo-YOGA-520-14IKB.32892: UDP, length 92
17:03:00.943356 IP lior-Lenovo-YOGA-520-14IKB.32892 > 142.250.82.70.3478: UDP, length 98
17:03:00.944998 IP 142.250.82.70.3478 > lior-Lenovo-YOGA-520-14IKB.39086: UDP, length 70
17:03:00.945127 IP lior-Lenovo-YOGA-520-14IKB.39086 > 142.250.82.70.3478: UDP, length 1201
17:03:00.948476 IP lior-Lenovo-YOGA-520-14IKB.39086 > 142.250.82.70.3478: UDP, length 1201
17:03:00.952654 IP lior-Lenovo-YOGA-520-14IKB.39086 > 142.250.82.70.3478: UDP, length 1201
17:03:00.956766 IP lior-Lenovo-YOGA-520-14IKB.39086 > 142.250.82.70.3478: UDP, length 1201
17:03:00.959944 IP lior-Lenovo-YOGA-520-14IKB.39086 > 142.250.82.70.3478: UDP, length 1201
17:03:00.963061 IP 142.250.82.70.3478 > lior-Lenovo-YOGA-520-14IKB.32892: UDP, length 76
17:03:00.963097 IP lior-Lenovo-YOGA-520-14IKB.32892 > 142.250.82.70.3478: UDP, length 93
17:03:00.964400 IP lior-Lenovo-YOGA-520-14IKB.39086 > 142.250.82.70.3478: UDP, length 1201
17:03:00.967738 IP lior-Lenovo-YOGA-520-14IKB.39086 > 142.250.82.70.3478: UDP, length 1201
17:03:00.972128 IP lior-Lenovo-YOGA-520-14IKB.39086 > 142.250.82.70.3478: UDP, length 1201
17:03:00.972411 IP 142.250.82.70.3478 > lior-Lenovo-YOGA-520-14IKB.32892: UDP, length 62
17:03:00.975301 IP lior-Lenovo-YOGA-520-14IKB.39086 > 142.250.82.70.3478: UDP, length 1201
17:03:00.979586 IP lior-Lenovo-YOGA-520-14IKB.39086 > 142.250.82.70.3478: UDP, length 1201
17:03:00.982543 IP lior-Lenovo-YOGA-520-14IKB.32892 > 142.250.82.70.3478: UDP, length 39
17:03:00.982727 IP lior-Lenovo-YOGA-520-14IKB.39086 > 142.250.82.70.3478: UDP, length 1201
17:03:00.983460 IP 142.250.82.70.3478 > lior-Lenovo-YOGA-520-14IKB.32892: UDP, length 82
17:03:00.987000 IP lior-Lenovo-YOGA-520-14IKB.39086 > 142.250.82.70.3478: UDP, length 1201
17:03:00.987542 IP lior-Lenovo-YOGA-520-14IKB.32892 > 142.250.82.70.3478: UDP, length 42
17:03:00.990203 IP lior-Lenovo-YOGA-520-14IKB.39086 > 142.250.82.70.3478: UDP, length 1201
17:03:00.994455 IP lior-Lenovo-YOGA-520-14IKB.39086 > 142.250.82.70.3478: UDP, length 1201
17:03:00.996604 IP 142.250.82.70.3478 > lior-Lenovo-YOGA-520-14IKB.39086: UDP, length 70
17:03:00.998914 IP lior-Lenovo-YOGA-520-14IKB.39086 > 142.250.82.70.3478: UDP, length 1201
17:03:01.003043 IP lior-Lenovo-YOGA-520-14IKB.39086 > 142.250.82.70.3478: UDP, length 1201
17:03:01.003518 IP 142.250.82.70.3478 > lior-Lenovo-YOGA-520-14IKB.32892: UDP, length 79
17:03:01.006434 IP lior-Lenovo-YOGA-520-14IKB.39086 > 142.250.82.70.3478: UDP, length 1201
17:03:01.009725 IP lior-Lenovo-YOGA-520-14IKB.39086 > 142.250.82.70.3478: UDP, length 1201
17:03:01.014140 IP lior-Lenovo-YOGA-520-14IKB.39086 > 142.250.82.70.3478: UDP, length 1201
17:03:01.017412 IP lior-Lenovo-YOGA-520-14IKB.39086 > 142.250.82.70.3478: UDP, length 1201
17:03:01.021774 IP lior-Lenovo-YOGA-520-14IKB.39086 > 142.250.82.70.3478: UDP, length 1201
17:03:01.023402 IP 142.250.82.70.3478 > lior-Lenovo-YOGA-520-14IKB.32892: UDP, length 81
17:03:01.024413 IP 142.250.82.70.3478 > lior-Lenovo-YOGA-520-14IKB.32892: UDP, length 62
17:03:01.024958 IP lior-Lenovo-YOGA-520-14IKB.39086 > 142.250.82.70.3478: UDP, length 1201
17:03:01.029347 IP lior-Lenovo-YOGA-520-14IKB.39086 > 142.250.82.70.3478: UDP, length 1201
17:03:01.032521 IP lior-Lenovo-YOGA-520-14IKB.39086 > 142.250.82.70.3478: UDP, length 1201
17:03:01.037042 IP lior-Lenovo-YOGA-520-14IKB.39086 > 142.250.82.70.3478: UDP, length 1201
17:03:01.037665 IP lior-Lenovo-YOGA-520-14IKB.32892 > 142.250.82.70.3478: UDP, length 38
17:03:01.040265 IP lior-Lenovo-YOGA-520-14IKB.39086 > 142.250.82.70.3478: UDP, length 1201
17:03:01.043821 IP 142.250.82.70.3478 > lior-Lenovo-YOGA-520-14IKB.32892: UDP, length 85
17:03:01.044648 IP lior-Lenovo-YOGA-520-14IKB.39086 > 142.250.82.70.3478: UDP, length 1201
17:03:01.047747 IP lior-Lenovo-YOGA-520-14IKB.39086 > 142.250.82.70.3478: UDP, length 1201
17:03:01.048740 IP 142.250.82.70.3478 > lior-Lenovo-YOGA-520-14IKB.39086: UDP, length 70
17:03:01.052013 IP lior-Lenovo-YOGA-520-14IKB.39086 > 142.250.82.70.3478: UDP, length 1201
17:03:01.055265 IP lior-Lenovo-YOGA-520-14IKB.39086 > 142.250.82.70.3478: UDP, length 1201
17:03:01.059517 IP lior-Lenovo-YOGA-520-14IKB.39086 > 142.250.82.70.3478: UDP, length 1201
17:03:01.063910 IP lior-Lenovo-YOGA-520-14IKB.39086 > 142.250.82.70.3478: UDP, length 1201
17:03:01.065404 IP 142.250.82.70.3478 > lior-Lenovo-YOGA-520-14IKB.32892: UDP, length 90
17:03:01.067139 IP lior-Lenovo-YOGA-520-14IKB.39086 > 142.250.82.70.3478: UDP, length 1201
17:03:01.070399 IP lior-Lenovo-YOGA-520-14IKB.39086 > 142.250.82.70.3478: UDP, length 1202
17:03:01.074700 IP lior-Lenovo-YOGA-520-14IKB.39086 > 142.250.82.70.3478: UDP, length 1202
17:03:01.075846 IP 142.250.82.70.3478 > lior-Lenovo-YOGA-520-14IKB.32892: UDP, length 58
17:03:01.078065 IP lior-Lenovo-YOGA-520-14IKB.39086 > 142.250.82.70.3478: UDP, length 1202
17:03:01.082337 IP lior-Lenovo-YOGA-520-14IKB.39086 > 142.250.82.70.3478: UDP, length 1202
17:03:01.086094 IP 142.250.82.70.3478 > lior-Lenovo-YOGA-520-14IKB.32892: UDP, length 86
17:03:01.086759 IP lior-Lenovo-YOGA-520-14IKB.39086 > 142.250.82.70.3478: UDP, length 1202
17:03:01.087865 IP lior-Lenovo-YOGA-520-14IKB.32892 > 142.250.82.70.3478: UDP, length 42
17:03:01.089988 IP lior-Lenovo-YOGA-520-14IKB.39086 > 142.250.82.70.3478: UDP, length 1202
17:03:01.094385 IP lior-Lenovo-YOGA-520-14IKB.39086 > 142.250.82.70.3478: UDP, length 1202
17:03:01.097497 IP lior-Lenovo-YOGA-520-14IKB.39086 > 142.250.82.70.3478: UDP, length 1202
17:03:01.099366 IP 142.250.82.70.3478 > lior-Lenovo-YOGA-520-14IKB.39086: UDP, length 70
17:03:01.102169 IP lior-Lenovo-YOGA-520-14IKB.39086 > 142.250.82.70.3478: UDP, length 1202
17:03:01.104861 IP 142.250.82.70.3478 > lior-Lenovo-YOGA-520-14IKB.32892: UDP, length 94
17:03:01.105289 IP lior-Lenovo-YOGA-520-14IKB.39086 > 142.250.82.70.3478: UDP, length 1202
17:03:01.109931 IP lior-Lenovo-YOGA-520-14IKB.39086 > 142.250.82.70.3478: UDP, length 1202
17:03:01.113303 IP lior-Lenovo-YOGA-520-14IKB.39086 > 142.250.82.70.3478: UDP, length 1202
17:03:01.116424 IP lior-Lenovo-YOGA-520-14IKB.39086 > 142.250.82.70.3478: UDP, length 65
17:03:01.116743 IP lior-Lenovo-YOGA-520-14IKB.39086 > 142.250.82.70.3478: UDP, length 1202
17:03:01.121163 IP lior-Lenovo-YOGA-520-14IKB.39086 > 142.250.82.70.3478: UDP, length 1202
17:03:01.123454 IP Dlink-Router.018.co.il.http > lior-Lenovo-YOGA-520-14IKB.45358: Flags [.], seq 1322983992:1322985440, ack 1904722465, win 7866, options [nop,nop,TS val 191270436 ecr 3094532659], length 1448: HTTP
17:03:01.123489 IP lior-Lenovo-YOGA-520-14IKB.45358 > Dlink-Router.018.co.il.http: Flags [.], ack 1448, win 63712, options [nop,nop,TS val 3094533450 ecr 191270436], length 0
17:03:01.123523 IP Dlink-Router.018.co.il.http > lior-Lenovo-YOGA-520-14IKB.45358: Flags [.], seq 1448:2896, ack 1, win 7866, options [nop,nop,TS val 191270436 ecr 3094532659], length 1448: HTTP
17:03:01.123533 IP lior-Lenovo-YOGA-520-14IKB.45358 > Dlink-Router.018.co.il.http: Flags [.], ack 2896, win 63712, options [nop,nop,TS val 3094533450 ecr 191270436], length 0
17:03:01.123539 00:80:30:08:ec:05 (oui Unknown) Unknown SSAP 0x80 > 30:08:ec:05:00:00 (oui Unknown) Null Information, send seq 0, rcv seq 0, Flags [Command], length 6
	0x0000:  0080 0000 0000                           ......
17:03:01.123566 IP Dlink-Router.018.co.il.http > lior-Lenovo-YOGA-520-14IKB.45358: Flags [P.], seq 2896:4096, ack 1, win 7866, options [nop,nop,TS val 191270436 ecr 3094532659], length 1200: HTTP
17:03:01.123579 IP lior-Lenovo-YOGA-520-14IKB.45358 > Dlink-Router.018.co.il.http: Flags [.], ack 4096, win 62512, options [nop,nop,TS val 3094533451 ecr 191270436], length 0
17:03:01.124170 IP 142.250.82.70.3478 > lior-Lenovo-YOGA-520-14IKB.32892: UDP, length 112
17:03:01.124554 IP lior-Lenovo-YOGA-520-14IKB.39086 > 142.250.82.70.3478: UDP, length 1202
17:03:01.128101 IP lior-Lenovo-YOGA-520-14IKB.39086 > 142.250.82.70.3478: UDP, length 1202
17:03:01.132672 IP lior-Lenovo-YOGA-520-14IKB.39086 > 142.250.82.70.3478: UDP, length 1202
17:03:01.136046 IP lior-Lenovo-YOGA-520-14IKB.39086 > 142.250.82.70.3478: UDP, length 1202
17:03:01.138338 IP lior-Lenovo-YOGA-520-14IKB.32892 > 142.250.82.70.3478: UDP, length 38
17:03:01.139427 IP lior-Lenovo-YOGA-520-14IKB.39086 > 142.250.82.70.3478: UDP, length 1202
17:03:01.142149 IP 142.250.82.70.3478 > lior-Lenovo-YOGA-520-14IKB.32892: UDP, length 115
17:03:01.143632 IP Dlink-Router.018.co.il.http > lior-Lenovo-YOGA-520-14IKB.45358: Flags [.], seq 4096:5544, ack 1, win 7866, options [nop,nop,TS val 191270438 ecr 3094533451], length 1448: HTTP
17:03:01.143691 IP lior-Lenovo-YOGA-520-14IKB.45358 > Dlink-Router.018.co.il.http: Flags [.], ack 5544, win 63712, options [nop,nop,TS val 3094533471 ecr 191270438], length 0
17:03:01.143743 IP Dlink-Router.018.co.il.http > lior-Lenovo-YOGA-520-14IKB.45358: Flags [.], seq 5544:6992, ack 1, win 7866, options [nop,nop,TS val 191270438 ecr 3094533451], length 1448: HTTP
17:03:01.143761 IP lior-Lenovo-YOGA-520-14IKB.45358 > Dlink-Router.018.co.il.http: Flags [.], ack 6992, win 63712, options [nop,nop,TS val 3094533471 ecr 191270438], length 0
17:03:01.143769 00:80:30:08:ec:05 (oui Unknown) Unknown SSAP 0x80 > 30:08:ec:05:00:00 (oui Unknown) Null Information, send seq 0, rcv seq 0, Flags [Command], length 6
	0x0000:  0080 0000 0000                           ......
17:03:01.143789 IP Dlink-Router.018.co.il.http > lior-Lenovo-YOGA-520-14IKB.45358: Flags [P.], seq 6992:8192, ack 1, win 7866, options [nop,nop,TS val 191270438 ecr 3094533451], length 1200: HTTP
17:03:01.143804 IP lior-Lenovo-YOGA-520-14IKB.45358 > Dlink-Router.018.co.il.http: Flags [.], ack 8192, win 62512, options [nop,nop,TS val 3094533471 ecr 191270438], length 0
17:03:01.144227 IP lior-Lenovo-YOGA-520-14IKB.39086 > 142.250.82.70.3478: UDP, length 1202
17:03:01.144477 IP Dlink-Router.018.co.il.http > lior-Lenovo-YOGA-520-14IKB.45358: Flags [.], seq 8192:9640, ack 1, win 7866, options [nop,nop,TS val 191270438 ecr 3094533471], length 1448: HTTP
17:03:01.144505 IP lior-Lenovo-YOGA-520-14IKB.45358 > Dlink-Router.018.co.il.http: Flags [.], ack 9640, win 63712, options [nop,nop,TS val 3094533471 ecr 191270438], length 0
17:03:01.144580 IP Dlink-Router.018.co.il.http > lior-Lenovo-YOGA-520-14IKB.45358: Flags [.], seq 9640:11088, ack 1, win 7866, options [nop,nop,TS val 191270438 ecr 3094533471], length 1448: HTTP
17:03:01.144599 IP lior-Lenovo-YOGA-520-14IKB.45358 > Dlink-Router.018.co.il.http: Flags [.], ack 11088, win 63712, options [nop,nop,TS val 3094533472 ecr 191270438], length 0
17:03:01.144606 00:80:30:08:ec:05 (oui Unknown) Unknown SSAP 0x80 > 30:08:ec:05:00:00 (oui Unknown) Null Information, send seq 0, rcv seq 0, Flags [Command], length 6
	0x0000:  0080 0000 0000                           ......
17:03:01.144626 IP Dlink-Router.018.co.il.http > lior-Lenovo-YOGA-520-14IKB.45358: Flags [P.], seq 11088:12223, ack 1, win 7866, options [nop,nop,TS val 191270438 ecr 3094533471], length 1135: HTTP
17:03:01.144673 IP lior-Lenovo-YOGA-520-14IKB.45358 > Dlink-Router.018.co.il.http: Flags [.], ack 12223, win 62577, options [nop,nop,TS val 3094533472 ecr 191270438], length 0
17:03:01.145158 IP Dlink-Router.018.co.il.http > lior-Lenovo-YOGA-520-14IKB.45358: Flags [F.], seq 12223, ack 1, win 7866, options [nop,nop,TS val 191270438 ecr 3094533472], length 0
17:03:01.145445 IP lior-Lenovo-YOGA-520-14IKB.45358 > Dlink-Router.018.co.il.http: Flags [F.], seq 1, ack 12224, win 63712, options [nop,nop,TS val 3094533472 ecr 191270438], length 0
17:03:01.145829 IP Dlink-Router.018.co.il.http > lior-Lenovo-YOGA-520-14IKB.45358: Flags [.], ack 2, win 7866, options [nop,nop,TS val 191270438 ecr 3094533472], length 0
17:03:01.147329 IP lior-Lenovo-YOGA-520-14IKB.39086 > 142.250.82.70.3478: UDP, length 1202
17:03:01.149556 IP lior-Lenovo-YOGA-520-14IKB.32892 > 142.250.82.70.3478: UDP, length 65
17:03:01.150376 IP 142.250.82.70.3478 > lior-Lenovo-YOGA-520-14IKB.39086: UDP, length 70
17:03:01.151684 IP lior-Lenovo-YOGA-520-14IKB.39086 > 142.250.82.70.3478: UDP, length 1202
17:03:01.155121 IP lior-Lenovo-YOGA-520-14IKB.39086 > 142.250.82.70.3478: UDP, length 1202
17:03:01.158512 IP lior-Lenovo-YOGA-520-14IKB.39086 > 142.250.82.70.3478: UDP, length 1202
17:03:01.161116 IP 142.250.82.70.3478 > lior-Lenovo-YOGA-520-14IKB.32892: UDP, length 114
17:03:01.162931 IP lior-Lenovo-YOGA-520-14IKB.39086 > 142.250.82.70.3478: UDP, length 1202
17:03:01.167093 IP lior-Lenovo-YOGA-520-14IKB.39086 > 142.250.82.70.3478: UDP, length 1202
17:03:01.170506 IP lior-Lenovo-YOGA-520-14IKB.39086 > 142.250.82.70.3478: UDP, length 1202
17:03:01.173716 IP lior-Lenovo-YOGA-520-14IKB.39086 > 142.250.82.70.3478: UDP, length 1202
17:03:01.177997 IP lior-Lenovo-YOGA-520-14IKB.39086 > 142.250.82.70.3478: UDP, length 1202
17:03:01.178860 IP 142.250.82.70.3478 > lior-Lenovo-YOGA-520-14IKB.39086: UDP, length 65
17:03:01.182352 IP 142.250.82.70.3478 > lior-Lenovo-YOGA-520-14IKB.32892: UDP, length 105
17:03:01.182448 IP lior-Lenovo-YOGA-520-14IKB.39086 > 142.250.82.70.3478: UDP, length 1202
17:03:01.185766 IP lior-Lenovo-YOGA-520-14IKB.39086 > 142.250.82.70.3478: UDP, length 1202
17:03:01.187328 IP lior-Lenovo-YOGA-520-14IKB.39086 > 142.250.82.70.3478: UDP, length 74
17:03:01.188351 IP lior-Lenovo-YOGA-520-14IKB.32892 > 142.250.82.70.3478: UDP, length 42
17:03:01.189990 IP lior-Lenovo-YOGA-520-14IKB.39086 > 142.250.82.70.3478: UDP, length 1202
17:03:01.193262 IP lior-Lenovo-YOGA-520-14IKB.39086 > 142.250.82.70.3478: UDP, length 1202
17:03:01.196505 IP lior-Lenovo-YOGA-520-14IKB.39086 > 142.250.82.70.3478: UDP, length 112
17:03:01.196574 IP lior-Lenovo-YOGA-520-14IKB.39086 > 142.250.82.70.3478: UDP, length 1202
17:03:01.200987 IP lior-Lenovo-YOGA-520-14IKB.39086 > 142.250.82.70.3478: UDP, length 1202
17:03:01.201272 IP 142.250.82.70.3478 > lior-Lenovo-YOGA-520-14IKB.39086: UDP, length 70
17:03:01.202661 IP 142.250.82.70.3478 > lior-Lenovo-YOGA-520-14IKB.32892: UDP, length 96
17:03:01.204233 IP lior-Lenovo-YOGA-520-14IKB.39086 > 142.250.82.70.3478: UDP, length 1202
17:03:01.208447 IP lior-Lenovo-YOGA-520-14IKB.39086 > 142.250.82.70.3478: UDP, length 1202
17:03:01.210839 IP 142.250.82.70.3478 > lior-Lenovo-YOGA-520-14IKB.32892: UDP, length 65
17:03:01.213040 IP lior-Lenovo-YOGA-520-14IKB.39086 > 142.250.82.70.3478: UDP, length 1202
17:03:01.216426 IP lior-Lenovo-YOGA-520-14IKB.39086 > 142.250.82.70.3478: UDP, length 1202
17:03:01.219737 IP lior-Lenovo-YOGA-520-14IKB.39086 > 142.250.82.70.3478: UDP, length 1202
17:03:01.222019 IP 142.250.82.70.3478 > lior-Lenovo-YOGA-520-14IKB.32892: UDP, length 92
17:03:01.224503 IP lior-Lenovo-YOGA-520-14IKB.39086 > 142.250.82.70.3478: UDP, length 1202
17:03:01.227546 IP lior-Lenovo-YOGA-520-14IKB.39086 > 142.250.82.70.3478: UDP, length 1202
17:03:01.232007 IP lior-Lenovo-YOGA-520-14IKB.39086 > 142.250.82.70.3478: UDP, length 1202
17:03:01.233183 IP whatsapp-cdn-shv-01-lhr8.fbcdn.net.https > lior-Lenovo-YOGA-520-14IKB.36440: Flags [P.], seq 4053249177:4053249280, ack 13490643, win 701, options [nop,nop,TS val 502910459 ecr 2952268313], length 103
17:03:01.233252 IP lior-Lenovo-YOGA-520-14IKB.36440 > whatsapp-cdn-shv-01-lhr8.fbcdn.net.https: Flags [.], ack 103, win 501, options [nop,nop,TS val 2952280922 ecr 502910459], length 0
17:03:01.236324 IP lior-Lenovo-YOGA-520-14IKB.39086 > 142.250.82.70.3478: UDP, length 1202
17:03:01.238711 IP lior-Lenovo-YOGA-520-14IKB.32892 > 142.250.82.70.3478: UDP, length 38
17:03:01.240138 IP lior-Lenovo-YOGA-520-14IKB.39086 > 142.250.82.70.3478: UDP, length 1202
17:03:01.241941 IP 142.250.82.70.3478 > lior-Lenovo-YOGA-520-14IKB.32892: UDP, length 91
17:03:01.244021 IP lior-Lenovo-YOGA-520-14IKB.39086 > 142.250.82.70.3478: UDP, length 1202
17:03:01.247002 IP lior-Lenovo-YOGA-520-14IKB.39086 > 142.250.82.70.3478: UDP, length 1202
17:03:01.250312 IP lior-Lenovo-YOGA-520-14IKB.39086 > 142.250.82.70.3478: UDP, length 1202
17:03:01.252568 IP 142.250.82.70.3478 > lior-Lenovo-YOGA-520-14IKB.39086: UDP, length 70
17:03:01.254696 IP lior-Lenovo-YOGA-520-14IKB.39086 > 142.250.82.70.3478: UDP, length 1202
17:03:01.257743 IP lior-Lenovo-YOGA-520-14IKB.39086 > 142.250.82.70.3478: UDP, length 1202
17:03:01.258280 IP 142.250.82.70.3478 > lior-Lenovo-YOGA-520-14IKB.39086: UDP, length 92
17:03:01.259545 IP lior-Lenovo-YOGA-520-14IKB.58850 > fra24s05-in-f14.1e100.net.443: UDP, length 1243
17:03:01.259591 IP lior-Lenovo-YOGA-520-14IKB.58850 > fra24s05-in-f14.1e100.net.443: UDP, length 670
17:03:01.262097 IP lior-Lenovo-YOGA-520-14IKB.39086 > 142.250.82.70.3478: UDP, length 1202
17:03:01.262142 IP 142.250.82.70.3478 > lior-Lenovo-YOGA-520-14IKB.32892: UDP, length 113
17:03:01.266439 IP lior-Lenovo-YOGA-520-14IKB.39086 > 142.250.82.70.3478: UDP, length 1202
17:03:01.269619 IP lior-Lenovo-YOGA-520-14IKB.39086 > 142.250.82.70.3478: UDP, length 1202
17:03:01.274033 IP lior-Lenovo-YOGA-520-14IKB.39086 > 142.250.82.70.3478: UDP, length 1202
17:03:01.277282 IP lior-Lenovo-YOGA-520-14IKB.39086 > 142.250.82.70.3478: UDP, length 1202
17:03:01.281628 IP lior-Lenovo-YOGA-520-14IKB.36440 > whatsapp-cdn-shv-01-lhr8.fbcdn.net.https: Flags [P.], seq 1:102, ack 103, win 501, options [nop,nop,TS val 2952280971 ecr 502910459], length 101
17:03:01.281767 IP lior-Lenovo-YOGA-520-14IKB.39086 > 142.250.82.70.3478: UDP, length 1202
17:03:01.282412 IP 142.250.82.70.3478 > lior-Lenovo-YOGA-520-14IKB.32892: UDP, length 105
17:03:01.284863 IP lior-Lenovo-YOGA-520-14IKB.39086 > 142.250.82.70.3478: UDP, length 1202
17:03:01.288569 IP lior-Lenovo-YOGA-520-14IKB.32892 > 142.250.82.70.3478: UDP, length 42
17:03:01.289147 IP lior-Lenovo-YOGA-520-14IKB.39086 > 142.250.82.70.3478: UDP, length 1202
17:03:01.292401 IP lior-Lenovo-YOGA-520-14IKB.39086 > 142.250.82.70.3478: UDP, length 1202
17:03:01.296830 IP lior-Lenovo-YOGA-520-14IKB.39086 > 142.250.82.70.3478: UDP, length 1202
17:03:01.300125 IP lior-Lenovo-YOGA-520-14IKB.39086 > 142.250.82.70.3478: UDP, length 1202
17:03:01.302551 IP 142.250.82.70.3478 > lior-Lenovo-YOGA-520-14IKB.32892: UDP, length 106
17:03:01.304075 IP 142.250.82.70.3478 > lior-Lenovo-YOGA-520-14IKB.39086: UDP, length 70
17:03:01.304328 IP lior-Lenovo-YOGA-520-14IKB.39086 > 142.250.82.70.3478: UDP, length 1202
17:03:01.307551 IP lior-Lenovo-YOGA-520-14IKB.39086 > 142.250.82.70.3478: UDP, length 1202
17:03:01.311768 IP lior-Lenovo-YOGA-520-14IKB.39086 > 142.250.82.70.3478: UDP, length 1202
17:03:01.316265 IP lior-Lenovo-YOGA-520-14IKB.39086 > 142.250.82.70.3478: UDP, length 1202
17:03:01.319437 IP lior-Lenovo-YOGA-520-14IKB.39086 > 142.250.82.70.3478: UDP, length 1202
17:03:01.322104 IP fra24s05-in-f14.1e100.net.443 > lior-Lenovo-YOGA-520-14IKB.58850: UDP, length 32
17:03:01.322763 IP lior-Lenovo-YOGA-520-14IKB.39086 > 142.250.82.70.3478: UDP, length 1202
17:03:01.323133 IP 142.250.82.70.3478 > lior-Lenovo-YOGA-520-14IKB.32892: UDP, length 105
17:03:01.326930 IP lior-Lenovo-YOGA-520-14IKB.39086 > 142.250.82.70.3478: UDP, length 1202
17:03:01.331446 IP lior-Lenovo-YOGA-520-14IKB.39086 > 142.250.82.70.3478: UDP, length 1202
17:03:01.334701 IP lior-Lenovo-YOGA-520-14IKB.39086 > 142.250.82.70.3478: UDP, length 1202
17:03:01.337349 IP fra24s05-in-f14.1e100.net.443 > lior-Lenovo-YOGA-520-14IKB.58850: UDP, length 26
17:03:01.337545 IP lior-Lenovo-YOGA-520-14IKB.58850 > fra24s05-in-f14.1e100.net.443: UDP, length 33
17:03:01.338028 IP lior-Lenovo-YOGA-520-14IKB.32892 > 142.250.82.70.3478: UDP, length 38
17:03:01.338158 IP lior-Lenovo-YOGA-520-14IKB.39086 > 142.250.82.70.3478: UDP, length 1202
17:03:01.342343 IP lior-Lenovo-YOGA-520-14IKB.39086 > 142.250.82.70.3478: UDP, length 1202
17:03:01.342466 IP 142.250.82.70.3478 > lior-Lenovo-YOGA-520-14IKB.32892: UDP, length 105
17:03:01.342593 IP fra24s05-in-f14.1e100.net.443 > lior-Lenovo-YOGA-520-14IKB.58850: UDP, length 467
17:03:01.342609 IP fra24s05-in-f14.1e100.net.443 > lior-Lenovo-YOGA-520-14IKB.58850: UDP, length 168
17:03:01.342614 00:80:24:08:d4:00 (oui Unknown) Unknown SSAP 0x80 > 24:08:ff:01:00:00 (oui Unknown) Null Information, send seq 0, rcv seq 0, Flags [Command], length 6
	0x0000:  0080 0000 0000                           ......
17:03:01.342937 IP lior-Lenovo-YOGA-520-14IKB.58850 > fra24s05-in-f14.1e100.net.443: UDP, length 39
17:03:01.346324 IP lior-Lenovo-YOGA-520-14IKB.39086 > 142.250.82.70.3478: UDP, length 1202
17:03:01.352101 IP lior-Lenovo-YOGA-520-14IKB.39086 > 142.250.82.70.3478: UDP, length 1202
17:03:01.355109 IP whatsapp-cdn-shv-01-lhr8.fbcdn.net.https > lior-Lenovo-YOGA-520-14IKB.36440: Flags [.], ack 102, win 701, options [nop,nop,TS val 502910579 ecr 2952280971], length 0
17:03:01.355162 IP 142.250.82.70.3478 > lior-Lenovo-YOGA-520-14IKB.39086: UDP, length 70
17:03:01.358484 IP lior-Lenovo-YOGA-520-14IKB.58850 > fra24s05-in-f14.1e100.net.443: UDP, length 33
17:03:01.362161 IP 142.250.82.70.3478 > lior-Lenovo-YOGA-520-14IKB.32892: UDP, length 98
17:03:01.383498 IP 142.250.82.70.3478 > lior-Lenovo-YOGA-520-14IKB.32892: UDP, length 43
17:03:01.384856 IP lior-Lenovo-YOGA-520-14IKB.32892 > 142.250.82.70.3478: UDP, length 86
17:03:01.388098 IP lior-Lenovo-YOGA-520-14IKB.32892 > 142.250.82.70.3478: UDP, length 42
17:03:01.405118 IP lior-Lenovo-YOGA-520-14IKB.32892 > 142.250.82.70.3478: UDP, length 39
17:03:01.407539 IP 142.250.82.70.3478 > lior-Lenovo-YOGA-520-14IKB.39086: UDP, length 70
17:03:01.420440 ARP, Request who-has lior-Lenovo-YOGA-520-14IKB tell LGwebOSTV.018.co.il, length 46
17:03:01.420450 ARP, Reply lior-Lenovo-YOGA-520-14IKB is-at f8:e4:3b:5b:e9:43 (oui Unknown), length 28
17:03:01.424908 IP fra24s05-in-f14.1e100.net.443 > lior-Lenovo-YOGA-520-14IKB.58850: UDP, length 26
17:03:01.459116 IP 142.250.82.70.3478 > lior-Lenovo-YOGA-520-14IKB.39086: UDP, length 58
17:03:01.460698 IP 142.250.82.70.3478 > lior-Lenovo-YOGA-520-14IKB.32892: UDP, length 146
17:03:01.487865 IP 142.250.82.70.3478 > lior-Lenovo-YOGA-520-14IKB.32892: UDP, length 58
17:03:01.567220 IP lior-Lenovo-YOGA-520-14IKB.018.co.il.42104 > 142.250.82.70.3478: UDP, length 108
17:03:01.578527 IP lior-Lenovo-YOGA-520-14IKB.39086 > 142.250.82.70.3478: UDP, length 94
17:03:01.591552 IP lior-Lenovo-YOGA-520-14IKB.39086 > 142.250.82.70.3478: UDP, length 1198
17:03:01.595650 IP lior-Lenovo-YOGA-520-14IKB.39086 > 142.250.82.70.3478: UDP, length 1198
17:03:01.600019 IP lior-Lenovo-YOGA-520-14IKB.39086 > 142.250.82.70.3478: UDP, length 1198
17:03:01.603224 IP lior-Lenovo-YOGA-520-14IKB.39086 > 142.250.82.70.3478: UDP, length 1198
17:03:01.607684 IP lior-Lenovo-YOGA-520-14IKB.39086 > 142.250.82.70.3478: UDP, length 1198
17:03:01.610819 IP lior-Lenovo-YOGA-520-14IKB.39086 > 142.250.82.70.3478: UDP, length 1198
17:03:01.615187 IP lior-Lenovo-YOGA-520-14IKB.39086 > 142.250.82.70.3478: UDP, length 1198
17:03:01.618420 IP lior-Lenovo-YOGA-520-14IKB.39086 > 142.250.82.70.3478: UDP, length 1198
17:03:01.622682 IP lior-Lenovo-YOGA-520-14IKB.39086 > 142.250.82.70.3478: UDP, length 1198
17:03:01.626798 IP lior-Lenovo-YOGA-520-14IKB.39086 > 142.250.82.70.3478: UDP, length 1198
17:03:01.629999 IP lior-Lenovo-YOGA-520-14IKB.39086 > 142.250.82.70.3478: UDP, length 1198
17:03:01.634448 IP lior-Lenovo-YOGA-520-14IKB.39086 > 142.250.82.70.3478: UDP, length 1198
17:03:01.637692 IP lior-Lenovo-YOGA-520-14IKB.39086 > 142.250.82.70.3478: UDP, length 1198
17:03:01.641005 IP lior-Lenovo-YOGA-520-14IKB.39086 > 142.250.82.70.3478: UDP, length 1198
17:03:01.643979 IP 142.250.82.70.3478 > lior-Lenovo-YOGA-520-14IKB.32892: UDP, length 117
17:03:01.645246 IP lior-Lenovo-YOGA-520-14IKB.39086 > 142.250.82.70.3478: UDP, length 1198
17:03:01.649600 IP lior-Lenovo-YOGA-520-14IKB.39086 > 142.250.82.70.3478: UDP, length 1198
17:03:01.652873 IP lior-Lenovo-YOGA-520-14IKB.39086 > 142.250.82.70.3478: UDP, length 1198
17:03:01.657276 IP lior-Lenovo-YOGA-520-14IKB.39086 > 142.250.82.70.3478: UDP, length 1198
17:03:01.660531 IP lior-Lenovo-YOGA-520-14IKB.39086 > 142.250.82.70.3478: UDP, length 1198
17:03:01.663587 IP 142.250.82.70.3478 > lior-Lenovo-YOGA-520-14IKB.39086: UDP, length 62
17:03:01.663880 IP lior-Lenovo-YOGA-520-14IKB.39086 > 142.250.82.70.3478: UDP, length 1198
17:03:01.665325 IP lior-Lenovo-YOGA-520-14IKB.41043 > Dlink-Router.018.co.il.domain: 10453+ PTR? 70.82.250.142.in-addr.arpa. (44)
17:03:01.665403 IP lior-Lenovo-YOGA-520-14IKB.49883 > Dlink-Router.018.co.il.domain: 26207+ PTR? 70.82.250.142.in-addr.arpa. (44)
17:03:01.666364 IP 142.250.82.70.3478 > lior-Lenovo-YOGA-520-14IKB.32892: UDP, length 122
17:03:01.668130 IP lior-Lenovo-YOGA-520-14IKB.39086 > 142.250.82.70.3478: UDP, length 1198
17:03:01.671143 IP Dlink-Router.018.co.il.domain > lior-Lenovo-YOGA-520-14IKB.41043: 10453 NXDomain 0/1/0 (104)
17:03:01.671593 IP Dlink-Router.018.co.il.domain > lior-Lenovo-YOGA-520-14IKB.49883: 26207 NXDomain 0/1/0 (104)
17:03:01.672325 IP lior-Lenovo-YOGA-520-14IKB.43849 > Dlink-Router.018.co.il.domain: 52943+ PTR? 18.0.168.192.in-addr.arpa. (43)
17:03:01.672391 IP lior-Lenovo-YOGA-520-14IKB.48706 > Dlink-Router.018.co.il.domain: 28456+ PTR? 18.0.168.192.in-addr.arpa. (43)
17:03:01.672402 IP lior-Lenovo-YOGA-520-14IKB.39086 > 142.250.82.70.3478: UDP, length 1198
17:03:01.675688 IP lior-Lenovo-YOGA-520-14IKB.39086 > 142.250.82.70.3478: UDP, length 1198
17:03:01.678070 IP Dlink-Router.018.co.il.domain > lior-Lenovo-YOGA-520-14IKB.43849: 52943 NXDomain* 0/1/0 (98)
17:03:01.678497 IP Dlink-Router.018.co.il.domain > lior-Lenovo-YOGA-520-14IKB.48706: 28456 NXDomain* 0/1/0 (98)
17:03:01.679650 IP lior-Lenovo-YOGA-520-14IKB.36474 > Dlink-Router.018.co.il.domain: 16203+ PTR? 1.0.168.192.in-addr.arpa. (42)
17:03:01.679715 IP lior-Lenovo-YOGA-520-14IKB.52159 > Dlink-Router.018.co.il.domain: 34856+ PTR? 1.0.168.192.in-addr.arpa. (42)
17:03:01.680173 IP lior-Lenovo-YOGA-520-14IKB.39086 > 142.250.82.70.3478: UDP, length 1198
17:03:01.680423 IP Dlink-Router.018.co.il.domain > lior-Lenovo-YOGA-520-14IKB.36474: 16203* 1/0/0 PTR Dlink-Router.018.co.il. (78)
17:03:01.680760 IP Dlink-Router.018.co.il.domain > lior-Lenovo-YOGA-520-14IKB.52159: 34856* 1/0/0 PTR Dlink-Router.018.co.il. (78)
17:03:01.680783 IP lior-Lenovo-YOGA-520-14IKB > Dlink-Router.018.co.il: ICMP lior-Lenovo-YOGA-520-14IKB udp port 52159 unreachable, length 114
17:03:01.681164 IP lior-Lenovo-YOGA-520-14IKB.33485 > Dlink-Router.018.co.il.domain: 7814+ PTR? 60.221.240.157.in-addr.arpa. (45)
17:03:01.681226 IP lior-Lenovo-YOGA-520-14IKB.53805 > Dlink-Router.018.co.il.domain: 16945+ PTR? 60.221.240.157.in-addr.arpa. (45)
17:03:01.682290 IP 142.250.82.70.3478 > lior-Lenovo-YOGA-520-14IKB.32892: UDP, length 125
17:03:01.683388 IP lior-Lenovo-YOGA-520-14IKB.39086 > 142.250.82.70.3478: UDP, length 1198
17:03:01.686703 IP lior-Lenovo-YOGA-520-14IKB.39086 > 142.250.82.70.3478: UDP, length 1198
17:03:01.688876 IP lior-Lenovo-YOGA-520-14IKB.32892 > 142.250.82.70.3478: UDP, length 42
17:03:01.690875 IP lior-Lenovo-YOGA-520-14IKB.39086 > 142.250.82.70.3478: UDP, length 1198
17:03:01.695322 IP lior-Lenovo-YOGA-520-14IKB.39086 > 142.250.82.70.3478: UDP, length 1198
17:03:01.698555 IP lior-Lenovo-YOGA-520-14IKB.39086 > 142.250.82.70.3478: UDP, length 1198
17:03:01.701574 IP lior-Lenovo-YOGA-520-14IKB.39086 > 142.250.82.70.3478: UDP, length 70
17:03:01.702068 IP 142.250.82.70.3478 > lior-Lenovo-YOGA-520-14IKB.32892: UDP, length 129
17:03:01.702820 IP lior-Lenovo-YOGA-520-14IKB.39086 > 142.250.82.70.3478: UDP, length 1198
17:03:01.706101 IP lior-Lenovo-YOGA-520-14IKB.39086 > 142.250.82.70.3478: UDP, length 1198
17:03:01.706178 IP lior-Lenovo-YOGA-520-14IKB.39086 > 142.250.82.70.3478: UDP, length 74
17:03:01.710514 IP lior-Lenovo-YOGA-520-14IKB.39086 > 142.250.82.70.3478: UDP, length 1198
17:03:01.713721 IP lior-Lenovo-YOGA-520-14IKB.39086 > 142.250.82.70.3478: UDP, length 1198
17:03:01.714792 IP 142.250.82.70.3478 > lior-Lenovo-YOGA-520-14IKB.39086: UDP, length 70
17:03:01.718157 IP lior-Lenovo-YOGA-520-14IKB.39086 > 142.250.82.70.3478: UDP, length 1198
17:03:01.721231 IP lior-Lenovo-YOGA-520-14IKB.39086 > 142.250.82.70.3478: UDP, length 1198
17:03:01.721989 IP 142.250.82.70.3478 > lior-Lenovo-YOGA-520-14IKB.32892: UDP, length 113
17:03:01.725495 IP lior-Lenovo-YOGA-520-14IKB.39086 > 142.250.82.70.3478: UDP, length 1198
17:03:01.728767 IP lior-Lenovo-YOGA-520-14IKB.39086 > 142.250.82.70.3478: UDP, length 1198
17:03:01.733018 IP lior-Lenovo-YOGA-520-14IKB.39086 > 142.250.82.70.3478: UDP, length 1198
17:03:01.737332 IP lior-Lenovo-YOGA-520-14IKB.39086 > 142.250.82.70.3478: UDP, length 1198
17:03:01.738975 IP lior-Lenovo-YOGA-520-14IKB.32892 > 142.250.82.70.3478: UDP, length 38
17:03:01.740502 IP lior-Lenovo-YOGA-520-14IKB.39086 > 142.250.82.70.3478: UDP, length 1198
17:03:01.741640 IP 142.250.82.70.3478 > lior-Lenovo-YOGA-520-14IKB.32892: UDP, length 92
17:03:01.744900 IP lior-Lenovo-YOGA-520-14IKB.39086 > 142.250.82.70.3478: UDP, length 1198
17:03:01.748164 IP lior-Lenovo-YOGA-520-14IKB.39086 > 142.250.82.70.3478: UDP, length 1198
17:03:01.752540 IP lior-Lenovo-YOGA-520-14IKB.39086 > 142.250.82.70.3478: UDP, length 1198
17:03:01.755747 IP lior-Lenovo-YOGA-520-14IKB.39086 > 142.250.82.70.3478: UDP, length 1198
17:03:01.760219 IP lior-Lenovo-YOGA-520-14IKB.39086 > 142.250.82.70.3478: UDP, length 1198
17:03:01.762094 IP 142.250.82.70.3478 > lior-Lenovo-YOGA-520-14IKB.32892: UDP, length 87
17:03:01.763409 IP lior-Lenovo-YOGA-520-14IKB.39086 > 142.250.82.70.3478: UDP, length 1198
17:03:01.766409 IP 142.250.82.70.3478 > lior-Lenovo-YOGA-520-14IKB.39086: UDP, length 70
17:03:01.766639 IP lior-Lenovo-YOGA-520-14IKB.39086 > 142.250.82.70.3478: UDP, length 1198
17:03:01.770858 IP lior-Lenovo-YOGA-520-14IKB.39086 > 142.250.82.70.3478: UDP, length 1198
17:03:01.775184 IP Dlink-Router.018.co.il.domain > lior-Lenovo-YOGA-520-14IKB.33485: 7814 1/2/4 PTR whatsapp-cdn-shv-01-lhr8.fbcdn.net. (228)
17:03:01.775431 IP Dlink-Router.018.co.il.domain > lior-Lenovo-YOGA-520-14IKB.53805: 16945 1/2/4 PTR whatsapp-cdn-shv-01-lhr8.fbcdn.net. (228)
17:03:01.775457 IP lior-Lenovo-YOGA-520-14IKB > Dlink-Router.018.co.il: ICMP lior-Lenovo-YOGA-520-14IKB udp port 53805 unreachable, length 264
17:03:01.775504 IP lior-Lenovo-YOGA-520-14IKB.39086 > 142.250.82.70.3478: UDP, length 1198
17:03:01.775921 IP lior-Lenovo-YOGA-520-14IKB.37657 > Dlink-Router.018.co.il.domain: 17470+ PTR? 78.186.250.142.in-addr.arpa. (45)
17:03:01.776487 IP lior-Lenovo-YOGA-520-14IKB.45540 > Dlink-Router.018.co.il.domain: 42804+ PTR? 28.0.168.192.in-addr.arpa. (43)
17:03:01.776552 IP lior-Lenovo-YOGA-520-14IKB.58989 > Dlink-Router.018.co.il.domain: 21402+ PTR? 28.0.168.192.in-addr.arpa. (43)
17:03:01.777361 IP Dlink-Router.018.co.il.domain > lior-Lenovo-YOGA-520-14IKB.45540: 42804* 1/0/0 PTR LGwebOSTV.018.co.il. (76)
17:03:01.777670 IP Dlink-Router.018.co.il.domain > lior-Lenovo-YOGA-520-14IKB.58989: 21402* 1/0/0 PTR LGwebOSTV.018.co.il. (76)
17:03:01.777687 IP lior-Lenovo-YOGA-520-14IKB > Dlink-Router.018.co.il: ICMP lior-Lenovo-YOGA-520-14IKB udp port 58989 unreachable, length 112
17:03:01.777869 IP lior-Lenovo-YOGA-520-14IKB.33252 > Dlink-Router.018.co.il.domain: 43069+ PTR? 69.0.168.192.in-addr.arpa. (43)
17:03:01.777933 IP lior-Lenovo-YOGA-520-14IKB.35155 > Dlink-Router.018.co.il.domain: 8169+ PTR? 69.0.168.192.in-addr.arpa. (43)
17:03:01.778551 IP Dlink-Router.018.co.il.domain > lior-Lenovo-YOGA-520-14IKB.33252: 43069* 1/0/0 PTR lior-Lenovo-YOGA-520-14IKB.018.co.il. (93)
17:03:01.778679 IP lior-Lenovo-YOGA-520-14IKB.39086 > 142.250.82.70.3478: UDP, length 1198
17:03:01.778891 IP Dlink-Router.018.co.il.domain > lior-Lenovo-YOGA-520-14IKB.35155: 8169* 1/0/0 PTR lior-Lenovo-YOGA-520-14IKB.018.co.il. (93)
17:03:01.778907 IP lior-Lenovo-YOGA-520-14IKB > Dlink-Router.018.co.il: ICMP lior-Lenovo-YOGA-520-14IKB udp port 35155 unreachable, length 129
17:03:01.781609 IP Dlink-Router.018.co.il.domain > lior-Lenovo-YOGA-520-14IKB.37657: 17470 1/4/8 PTR fra24s05-in-f14.1e100.net. (342)
17:03:01.781627 IP lior-Lenovo-YOGA-520-14IKB > Dlink-Router.018.co.il: ICMP lior-Lenovo-YOGA-520-14IKB udp port 37657 unreachable, length 378
17:03:01.781871 IP lior-Lenovo-YOGA-520-14IKB.39086 > 142.250.82.70.3478: UDP, length 1198
17:03:01.782172 IP 142.250.82.70.3478 > lior-Lenovo-YOGA-520-14IKB.32892: UDP, length 79
17:03:01.786148 IP lior-Lenovo-YOGA-520-14IKB.39086 > 142.250.82.70.3478: UDP, length 1198
17:03:01.789146 IP lior-Lenovo-YOGA-520-14IKB.32892 > 142.250.82.70.3478: UDP, length 42
17:03:01.790468 IP lior-Lenovo-YOGA-520-14IKB.39086 > 142.250.82.70.3478: UDP, length 1198
17:03:01.793844 IP lior-Lenovo-YOGA-520-14IKB.39086 > 142.250.82.70.3478: UDP, length 1198
17:03:01.798028 IP lior-Lenovo-YOGA-520-14IKB.39086 > 142.250.82.70.3478: UDP, length 1198
17:03:01.801329 IP lior-Lenovo-YOGA-520-14IKB.39086 > 142.250.82.70.3478: UDP, length 1198
17:03:01.802090 IP 142.250.82.70.3478 > lior-Lenovo-YOGA-520-14IKB.32892: UDP, length 78
17:03:01.805793 IP lior-Lenovo-YOGA-520-14IKB.39086 > 142.250.82.70.3478: UDP, length 1198
17:03:01.806235 IP lior-Lenovo-YOGA-520-14IKB.32892 > 142.250.82.70.3478: UDP, length 97
17:03:01.808971 IP lior-Lenovo-YOGA-520-14IKB.39086 > 142.250.82.70.3478: UDP, length 1198
17:03:01.813348 IP lior-Lenovo-YOGA-520-14IKB.39086 > 142.250.82.70.3478: UDP, length 1198
17:03:01.816710 IP lior-Lenovo-YOGA-520-14IKB.39086 > 142.250.82.70.3478: UDP, length 1199
17:03:01.817194 IP 142.250.82.70.3478 > lior-Lenovo-YOGA-520-14IKB.39086: UDP, length 70
17:03:01.821043 IP lior-Lenovo-YOGA-520-14IKB.39086 > 142.250.82.70.3478: UDP, length 1199
17:03:01.822609 IP lior-Lenovo-YOGA-520-14IKB.39086 > 142.250.82.70.3478: UDP, length 70
17:03:01.823977 IP 142.250.82.70.3478 > lior-Lenovo-YOGA-520-14IKB.32892: UDP, length 80
17:03:01.824299 IP lior-Lenovo-YOGA-520-14IKB.39086 > 142.250.82.70.3478: UDP, length 1199
17:03:01.825503 IP lior-Lenovo-YOGA-520-14IKB.32892 > 142.250.82.70.3478: UDP, length 39
17:03:01.827570 IP lior-Lenovo-YOGA-520-14IKB.39086 > 142.250.82.70.3478: UDP, length 1199
